{
    "tape" : " ",
    "position" : 0,
    "m-config" : "𝔟",
    "table" : [    
	["𝔟", null, ["Pә","R","Pә","R","P0","R","R","P0","L","L"], "𝔬"],
	["𝔬", "1",  [         "R", "Px", "L", "L", "L"          ], "𝔬"],
	["𝔬", "0",  [                                           ], "𝔮"],
	["𝔮", "01", [                   "R" , "R"               ], "𝔮"],
	["𝔮", " ",  [                   "P1", "L"               ], "𝔭"],
	["𝔭", "x",  [                   "E" , "R"               ], "𝔮"],
	["𝔭", "ә",  [                      "R"                  ], "𝔣"],
	["𝔭", " ",  [                   "L", "L"                ], "𝔭"],
	["𝔣", true, [                   "R", "R"                ], "𝔣"],
	["𝔣", " ",  [                  "P0","L","L"             ], "𝔬"]
    ],
    "comments" : "Turing's second example machine (Turing 1936)"
}
